{
  "$schema": "https://json-schema.org/draft/2020-12/schema",
  "title": "Context Capsule Project Manager metadata v2",
  "type": "object",
  "required": [
    "schema",
    "version",
    "source",
    "installed_at",
    "repository",
    "update_policy"
  ],
  "properties": {
    "schema": {
      "const": "context-capsule"
    },
    "version": {
      "enum": ["2.0.0-dev", "2.1.0"],
      "deprecated": true,
      "description": "Deprecated compatibility alias for Project Manager version."
    },
    "source": {
      "enum": [
        "lvlaksim1/context-capsule-project-manager",
        "lvlaksim1/context-capsule"
      ]
    },
    "core_commit": {
      "type": "string",
      "pattern": "^[0-9a-f]{40}$",
      "deprecated": true
    },
    "project_manager_commit": {
      "type": "string",
      "pattern": "^[0-9a-f]{40}$"
    },
    "context_capsule_commit": {
      "type": "string",
      "pattern": "^[0-9a-f]{40}$"
    },
    "provenance": {
      "type": "object",
      "required": [
        "context_capsule",
        "project_manager"
      ],
      "properties": {
        "context_capsule": {
          "type": "object",
          "required": [
            "repository",
            "commit"
          ],
          "properties": {
            "repository": {
              "const": "lvlaksim1/context-capsule"
            },
            "commit": {
              "type": "string",
              "pattern": "^[0-9a-f]{40}$"
            }
          },
          "additionalProperties": false
        },
        "project_manager": {
          "type": "object",
          "required": [
            "repository",
            "commit"
          ],
          "properties": {
            "repository": {
              "const": "lvlaksim1/context-capsule-project-manager"
            },
            "commit": {
              "type": "string",
              "pattern": "^[0-9a-f]{40}$"
            }
          },
          "additionalProperties": false
        }
      },
      "additionalProperties": false
    },
    "installed_at": {
      "type": "string"
    },
    "repository": {
      "type": "string",
      "pattern": "^[^/]+/[^/]+$"
    },
    "update_policy": {
      "const": "manual"
    },
    "adopted_from": {
      "type": "string"
    },
    "context_capsule_version": {
      "const": "1.3.1"
    },
    "project_manager_version": {
      "enum": ["2.0.0-dev", "2.1.0"]
    },
    "context_capsule": {
      "type": "object",
      "required": [
        "version",
        "repository",
        "commit"
      ],
      "properties": {
        "version": {
          "const": "1.3.1"
        },
        "repository": {
          "const": "lvlaksim1/context-capsule"
        },
        "commit": {
          "type": "string",
          "pattern": "^[0-9a-f]{40}$"
        }
      },
      "additionalProperties": false
    },
    "project_manager": {
      "type": "object",
      "required": [
        "version",
        "repository",
        "commit"
      ],
      "properties": {
        "version": {
          "enum": ["2.0.0-dev", "2.1.0"]
        },
        "repository": {
          "const": "lvlaksim1/context-capsule-project-manager"
        },
        "commit": {
          "type": "string",
          "pattern": "^[0-9a-f]{40}$"
        }
      },
      "additionalProperties": false
    }
  },
  "anyOf": [
    {
      "required": [
        "context_capsule",
        "project_manager",
        "context_capsule_version",
        "project_manager_version",
        "provenance",
        "project_manager_commit",
        "context_capsule_commit"
      ]
    },
    {
      "required": [
        "provenance",
        "project_manager_commit",
        "context_capsule_commit"
      ]
    },
    {
      "required": [
        "core_commit"
      ]
    }
  ],
  "additionalProperties": true
}
