{
  "schema": "context-capsule",
  "version": "2.1.0",
  "source": "lvlaksim1/context-capsule-project-manager",
  "core_commit": "9d6a2f69d38d880c44ea59c9b3d31b406cc5bcf1",
  "installed_at": "2026-10-03",
  "repository": "lvlaksim1/context-capsule-project-manager",
  "update_policy": "manual",
  "project_manager_commit": "9d6a2f69d38d880c44ea59c9b3d31b406cc5bcf1",
  "context_capsule_commit": "2ef41a5ed57ae514cc5980065560d7e55d5e4b9a",
  "provenance": {
    "context_capsule": {
      "repository": "lvlaksim1/context-capsule",
      "commit": "2ef41a5ed57ae514cc5980065560d7e55d5e4b9a"
    },
    "project_manager": {
      "repository": "lvlaksim1/context-capsule-project-manager",
      "commit": "9d6a2f69d38d880c44ea59c9b3d31b406cc5bcf1"
    }
  },
  "context_capsule_version": "1.3.1",
  "project_manager_version": "2.1.0",
  "context_capsule": {
    "version": "1.3.1",
    "repository": "lvlaksim1/context-capsule",
    "commit": "2ef41a5ed57ae514cc5980065560d7e55d5e4b9a"
  },
  "project_manager": {
    "version": "2.1.0",
    "repository": "lvlaksim1/context-capsule-project-manager",
    "commit": "9d6a2f69d38d880c44ea59c9b3d31b406cc5bcf1"
  }
}
